{"$schema": "https://json-schema.org/draft/2020-12/schema", "title": "Sealed final result (includes normative spec set)", "type": "object", "required": ["experiment_id", "finite_exact_sizes", "bn_results", "canonical_potentials_complete", "critical_derivatives_complete", "best_H_hypothesis", "universal_pair_access_lemma", "approximate_monotonicity_proved", "dynamic_optimality_proved", "unbounded_counterexample_family_proved", "claim_level", "normative_spec_set"], "properties": {"experiment_id": {"type": "string"}, "finite_exact_sizes": {"type": "array", "items": {"type": "integer"}}, "bn_results": {"type": "array"}, "canonical_potentials_complete": {"type": "boolean"}, "critical_derivatives_complete": {"type": "boolean"}, "best_H_hypothesis": {"type": ["string", "null"]}, "universal_pair_access_lemma": {"type": "boolean"}, "approximate_monotonicity_proved": {"type": "boolean"}, "dynamic_optimality_proved": {"type": "boolean"}, "unbounded_counterexample_family_proved": {"type": "boolean"}, "claim_level": {"type": "string", "enum": ["FINITE_INFRASTRUCTURE_ONLY", "FINITE_EXACT_BN_RESULTS", "FINITE_THEOREM_MINING_ONLY", "CANDIDATE_H_SURVIVES_FINITE_TESTS", "UNIVERSAL_PAIR_ACCESS_LEMMA_PROVED", "DYNAMIC_OPTIMALITY_PROVED", "DYNAMIC_OPTIMALITY_DISPROVED"]}, "normative_spec_set": {"type": "array", "items": {"type": "object", "required": ["version", "sha256"], "properties": {"version": {"type": "string"}, "sha256": {"type": "string"}}}}}}